{
  "schemaVersion": 1,
  "type": "provider.usageAggregateRecorded",
  "usageRecordId": "pusage-provider-openai-main-2026-07-rev2",
  "reportSubjectId": "openai-billing:2026-07-20T00:00:00Z/2026-07-27T00:00:00Z",
  "revision": 2,
  "supersedesUsageRecordId": "pusage-provider-openai-main-2026-07-rev1",
  "providerProfileId": "provider-openai-main",
  "engine": "codex",
  "window": { "startedAt": 1784505600000, "endedAt": 1785110400000 },
  "coveredAttemptIds": ["attempt-01JZXC4TS8", "attempt-01JZXP9QW2"],
  "usage": {
    "inputTokens": 1523000,
    "cachedInputTokens": 890000,
    "outputTokens": 214000,
    "totalTokens": 1737000,
    "providerReportedCost": { "amount": "4.13", "currency": "USD" }
  },
  "breakdown": {
    "kind": "provider-authoritative",
    "attempts": [
      {
        "attemptId": "attempt-01JZXC4TS8",
        "usage": { "inputTokens": 15230, "cachedInputTokens": 8900, "outputTokens": 2140, "totalTokens": 17370 }
      },
      {
        "attemptId": "attempt-01JZXP9QW2",
        "usage": { "inputTokens": 1507770, "cachedInputTokens": 881100, "outputTokens": 211860, "totalTokens": 1719630 }
      }
    ]
  },
  "observedAt": 1785144000000
}
